{
  "$schema": "../../schemas/wire-conformance-target.schema.json",
  "target_name": "sample-preview4-target",
  "protocol_version": "nnrp-1-preview4",
  "suite_version": "0.1.0",
  "wire_conformance": {
    "modes": [
      "suite_as_client",
      "suite_as_server",
      "suite_as_proxy"
    ],
    "transports": [
      {
        "name": "tcp",
        "endpoint": "127.0.0.1:19091",
        "tls": false
      },
      {
        "name": "quic",
        "endpoint": "127.0.0.1:19092",
        "tls": true,
        "security": {
          "server_name": "localhost",
          "trusted_certificate_der_path": "certs/server.der",
          "certificate_der_path": "certs/server.der",
          "private_key_pkcs8_der_path": "certs/server-key.der"
        }
      },
      {
        "name": "ipc",
        "endpoint": "npipe://nnrp-preview4-sample",
        "tls": false
      },
      {
        "name": "websocket",
        "endpoint": "ws://127.0.0.1:19093/nnrp",
        "tls": false
      }
    ],
    "host_route_providers": [
      {
        "transport": "tcp",
        "provider_id": "nnrp.transport.tcp.native",
        "installed": true,
        "platforms": ["native"],
        "security_modes": ["plain", "tls_server_auth", "mutual_tls"]
      },
      {
        "transport": "quic",
        "provider_id": "nnrp.transport.quic.native",
        "installed": true,
        "platforms": ["native"],
        "security_modes": ["tls_server_auth", "mutual_tls"]
      },
      {
        "transport": "ipc",
        "provider_id": "nnrp.transport.ipc.native",
        "installed": true,
        "platforms": ["native"],
        "security_modes": ["plain"]
      },
      {
        "transport": "websocket",
        "provider_id": "nnrp.transport.websocket.browser-wasm",
        "installed": true,
        "platforms": ["browser"],
        "security_modes": ["browser_host"]
      }
    ],
    "capabilities": [
      "control.cancel_abort",
      "control.priority_update",
      "control.deadline_expire",
      "control.progress_partial",
      "control.credit_backpressure",
      "control.capability_costs",
      "control.route_execution_hint",
      "cache.reference",
      "control.trace_context",
      "control.result_drop_reason",
      "control.degrade_profile",
      "control.budget_update",
      "object.lifecycle",
      "host.routes"
    ],
    "limits": {
      "max_frame_bytes": 16777216,
      "max_in_flight": 256
    }
  }
}
